{
  "schema_version": "1.0.0",
  "contract_version": "1.0.0",
  "runtime_version": "1.0.0",
  "compatibility_version": "mitra-companion-1",
  "catalog_version": "2026-07-06",
  "purpose": "Runtime-readable map of useful systems and features copied, adapted, or externalized from previous submissions into the Mitra Live Runtime Sprint.",
  "selection_policy": {
    "import_when": [
      "The feature is generic runtime infrastructure.",
      "The feature improves product discovery, routing, persistence, telemetry, proof, recovery, or operator review.",
      "The feature can be driven by published manifests, schemas, APIs, or durable runtime receipts."
    ],
    "externalize_when": [
      "The feature is a product-owned capability implementation.",
      "The feature is a downstream authority, validation, provenance, convergence, or review system.",
      "The feature requires independent business data, governance posture, or product-specific execution rules."
    ],
    "never_import": [
      "Product-specific branches inside the Mitra runtime.",
      "Authority or review decisions that belong after Mitra has routed the product response.",
      "Evidence or provenance internals that can be represented as portable dispatch proofs or downstream handoff contracts."
    ]
  },
  "previous_submissions": [
    {
      "submission_id": "companion-runtime-foundations",
      "local_folder": "Companion-Runtime-Foundations",
      "useful_systems": [
        "session runtime",
        "context runtime",
        "intent router",
        "attachment runtime",
        "lifecycle state machine",
        "versioned integration contracts"
      ],
      "copied_or_mapped_features": [
        "durable sessions and resume tokens",
        "partitioned context and transfer",
        "manifest-driven attachment",
        "explicit intent routing",
        "OpenAPI and JSON Schema contract catalog"
      ],
      "externalized_systems": []
    },
    {
      "submission_id": "phase-iv-runtime-foundation",
      "local_folder": "Mitra-Phase-IV-Runtime-Foundation",
      "useful_systems": [
        "continuous runtime operation",
        "startup validation",
        "failure simulation evidence",
        "container deployment verification"
      ],
      "copied_or_mapped_features": [
        "persistent runtime supervisor",
        "runtime instance heartbeat",
        "stale peer cleanup",
        "interrupted task recovery",
        "operational runbook validation"
      ],
      "externalized_systems": []
    },
    {
      "submission_id": "ecosystem-runtime-hardening",
      "local_folder": "Ecosystem-Runtime-Hardening-Assignment",
      "useful_systems": [
        "production deployment profile",
        "health and readiness probes",
        "structured telemetry",
        "metrics and tracing",
        "load testing"
      ],
      "copied_or_mapped_features": [
        "Docker Compose production posture",
        "OpenTelemetry and Prometheus surfaces",
        "attachment health monitoring",
        "recovery validation",
        "k6 load profile"
      ],
      "externalized_systems": []
    },
    {
      "submission_id": "commercial-platform-foundation",
      "local_folder": "Commercial-Platform-Architecture-and-Runtime-Foundation",
      "useful_systems": [
        "capability manifests",
        "dependency manifests",
        "runtime boot sequence",
        "interface manifests",
        "platform architecture manifest"
      ],
      "copied_or_mapped_features": [
        "runtime capability catalog",
        "capability dependency graph",
        "contract-first product intake",
        "future-product manifest checklist"
      ],
      "externalized_systems": [
        "commercial pricing logic",
        "commercial data models",
        "product-specific workflows"
      ]
    },
    {
      "submission_id": "runtime-evidence-producer",
      "local_folder": "Runtime-Evidence-Producer",
      "useful_systems": [
        "canonical proof schema",
        "execution receipt hashing",
        "lineage bundle",
        "consumer handoff"
      ],
      "copied_or_mapped_features": [
        "dispatch phase journal",
        "portable dispatch proof bundle",
        "request, context, response, and phase hashes",
        "lineage nodes for runtime and attached product boundaries"
      ],
      "externalized_systems": [
        "downstream evidence production authority",
        "reviewer decision logic"
      ]
    },
    {
      "submission_id": "constitutional-runtime-convergence",
      "local_folder": "constitutional-runtime-convergence-sprint",
      "useful_systems": [
        "command-chain model",
        "handoff trace",
        "downstream authority ordering"
      ],
      "copied_or_mapped_features": [
        "runtime command-chain contract",
        "Mitra-to-product-to-downstream boundary model",
        "trace handoff vocabulary"
      ],
      "externalized_systems": [
        "TANTRA",
        "SHAKTI",
        "MDU",
        "TMS",
        "Parikshak"
      ]
    },
    {
      "submission_id": "shakti-and-parikshak-systems",
      "local_folder": "Shakti-GC-Infra; Parikshak-system",
      "useful_systems": [
        "validation authority consumer",
        "review readiness consumer"
      ],
      "copied_or_mapped_features": [
        "external capability relationship",
        "proof handoff expectation",
        "post-Mitra execution boundary"
      ],
      "externalized_systems": [
        "SHAKTI constitutional validation internals",
        "Parikshak review readiness internals"
      ]
    },
    {
      "submission_id": "accessible-bhiv-product-fixtures",
      "local_folder": "uniguru_ai; trade-bot-main",
      "useful_systems": [
        "real product health endpoints",
        "real product dispatch endpoints",
        "native product request bodies"
      ],
      "copied_or_mapped_features": [
        "UniGuru product manifest",
        "Samruddhi trade-bot product manifest",
        "native HTTP payload projection",
        "contract and integration tests"
      ],
      "externalized_systems": [
        "UniGuru teaching logic",
        "Samruddhi market prediction logic"
      ]
    }
  ],
  "runtime_imports": [
    {
      "feature_id": "durable-session-context-routing-foundation",
      "source_submission_ids": ["companion-runtime-foundations"],
      "implemented_in": [
        "pratham/session-runtime",
        "pratham/context-runtime",
        "pratham/intent-router",
        "pratham/attachment-runtime",
        "pratham/companion-runtime"
      ],
      "runtime_surface": "sessions, contexts, attachments, intents, dispatch",
      "used_for": [
        "preserve customer continuity",
        "load least required context",
        "route only explicit registered capabilities"
      ],
      "boundary": "internal-runtime"
    },
    {
      "feature_id": "persistent-production-runtime",
      "source_submission_ids": [
        "phase-iv-runtime-foundation",
        "ecosystem-runtime-hardening"
      ],
      "implemented_in": [
        "mitra_companion.startup.RuntimeStartupManager",
        "mitra_companion.runtime.PersistentRuntimeSupervisor",
        "mitra_companion.store.mark_stale_runtime_instances",
        "mitra_companion.store.recover_interrupted_companion_tasks",
        "mitra_companion.config.RuntimeSettings.production_summary",
        "mitra_companion.config.RuntimeSettings.secrets_summary",
        "mitra_companion.production_logging.configure_production_logging",
        "/api/v1/runtime/startup",
        "/api/v1/runtime/restart",
        "/api/v1/runtime/recovery",
        "/api/v1/runtime/config",
        "/api/v1/runtime/secrets",
        "/api/v1/runtime/instances/reconcile"
      ],
      "runtime_surface": "runtime status, startup manager, instance heartbeat, persistent tick, restart, recovery, redacted production config and secrets",
      "used_for": [
        "keep Mitra alive as a service process",
        "recover interrupted tasks",
        "clean stale runtime peers",
        "load production configuration",
        "operate graceful restart and recovery",
        "redact production secrets"
      ],
      "boundary": "internal-runtime"
    },
    {
      "feature_id": "capability-dependency-catalog",
      "source_submission_ids": [
        "commercial-platform-foundation",
        "companion-runtime-foundations"
      ],
      "implemented_in": [
        "mitra_companion.dependency_registry.CapabilityDependencyRegistry",
        "/api/v1/runtime/capability-catalog"
      ],
      "runtime_surface": "runtime capability catalog",
      "used_for": [
        "understand attached product dependencies",
        "review capability inputs and dispatch targets",
        "prepare future product intake"
      ],
      "boundary": "contract-only"
    },
    {
      "feature_id": "assignment-and-product-fit-analysis",
      "source_submission_ids": [
        "commercial-platform-foundation",
        "companion-runtime-foundations"
      ],
      "implemented_in": [
        "mitra_companion.analysis.RuntimeAnalyzer",
        "/api/v1/runtime/analysis",
        "/api/v1/companion/messages"
      ],
      "runtime_surface": "runtime analysis and companion message analysis",
      "used_for": [
        "contextualize assignment text",
        "extract customer expectation",
        "match expectation to attached capability"
      ],
      "boundary": "internal-runtime"
    },
    {
      "feature_id": "dispatch-proof-and-phase-journal",
      "source_submission_ids": [
        "runtime-evidence-producer",
        "phase-iv-runtime-foundation"
      ],
      "implemented_in": [
        "mitra_companion.proofs.DispatchProofBuilder",
        "mitra_companion.store.dispatch_phases",
        "/api/v1/dispatches/{dispatch_id}/phases",
        "/api/v1/dispatches/{dispatch_id}/proof"
      ],
      "runtime_surface": "dispatch proof and phase APIs",